{
  "$schema": "https://json-schema.org/draft/2020-12/schema",
  "$id": "https://hummingbird.dev/hnf/v0.1/domains/mechanical.json",
  "title": "HNF domain: mechanical",
  "description": "MCAD mechanical domain — solids and constraints (HNF v0.1 Phase 0).",
  "type": "object",
  "additionalProperties": false,
  "required": ["domain", "version", "hnf_type", "object_id", "properties"],
  "properties": {
    "domain": { "const": "mechanical" },
    "version": { "const": "0.1" },
    "hnf_type": { "type": "string", "minLength": 1, "default": "hardware.object" },
    "object_id": { "type": "string", "minLength": 1 },
    "content_hash": {
      "type": "string",
      "pattern": "^[0-9a-fA-F]{64}$",
      "description": "SHA-256 of HNFT blob (STEP/BREP mesh)"
    },
    "refs": {
      "type": "array",
      "items": { "type": "string", "minLength": 1 },
      "default": []
    },
    "properties": {
      "type": "object",
      "additionalProperties": false,
      "required": ["solids"],
      "properties": {
        "solids": {
          "type": "array",
          "minItems": 1,
          "items": { "$ref": "#/$defs/solid" }
        },
        "constraints": {
          "type": "array",
          "items": { "$ref": "#/$defs/constraint" },
          "default": []
        }
      }
    }
  },
  "$defs": {
    "solid": {
      "type": "object",
      "additionalProperties": false,
      "required": ["id", "name"],
      "properties": {
        "id": { "type": "string", "minLength": 1 },
        "name": { "type": "string", "minLength": 1 },
        "material": { "type": "string" },
        "volume_mm3": { "type": "number", "exclusiveMinimum": 0 }
      }
    },
    "constraint": {
      "type": "object",
      "additionalProperties": false,
      "required": ["id", "type", "solid_a"],
      "properties": {
        "id": { "type": "string", "minLength": 1 },
        "type": { "type": "string", "minLength": 1 },
        "solid_a": { "type": "string", "minLength": 1 },
        "solid_b": { "type": "string", "minLength": 1 }
      }
    }
  }
}
